id,codigo,nome_social,nome_resumido,cnpj,situacao_ativa,codigo_isin
34829,AALR,ALLIANCA SAUDE E PARTICIPACOES S A,ALLIAR,42.771.949/0001-35,True,BRAALRACNOR6
34862,ABCB,BCO ABC BRASIL SA,ABCBRASIL08Y,28.195.667/0001-06,True,BRABCBACNPR4
34883,ABEV,AMBEV S A,AMBEVSA09J,07.526.557/0001-00,True,BRABEVACNOR1
34932,ABRE,ABRIL EDUCACAO SA,ABRILEDUC0AW,02.541.982/0001-54,False,BRABREACNOR9
34968,ABYA,ABYARA PLANEJAMENTO IMOBILIARIO SA,ABYARA0BW,07.794.351/0001-60,True,BRABYAACNOR3
35024,ACES,ARCELORMITTAL INOX BRASIL SA,AMINOXBR0DG,33.390.170/0001-89,True,BRACESACNOR5
35024,ACES,ARCELORMITTAL INOX BRASIL SA,AMINOXBR0DG,33.390.170/0001-89,True,BRACESACNPR2
35038,ACGU,ACUCAR GUARANI SA,GUARANI0DU,47.080.619/0001-17,True,BRACGUACNOR6
35209,ADHM,ADVANCED DIGITAL HEALTH MEDICINA PREVENTIVA SA,ADVANCEDD0IL,10.345.009/0001-98,True,BRADHMACNOR9
35299,AEDU,ANHANGUERA EDUCACIONAL PARTICIPACOES SA,ANHANGUER0L3,04.310.392/0001-46,True,BRAEDUACNOR9
35323,AELP,AES ELPA SA,AESELPA0LR,01.917.705/0001-30,True,BRAELPACNOR2
95924,AERI,AERIS INDUSTRIA E COMERCIO DE EQUIPAMENTOS PARA GERACAO DE ENERGIA S A,AERISENERGIA,12.528.708/0001-07,True,BRAERIACNOR4
101053,AESB,AES BRASIL ENERGIA S A,AES BRASIL,37.663.076/0001-07,True,BRAESBACNOR7
35332,AESL,RGE SUL DISTRIBUIDORA ENERGIA SA,AESSUL0M0,02.016.440/0001-62,True,BRAESLACNOR6
35332,AESL,RGE SUL DISTRIBUIDORA ENERGIA SA,AESSUL0M0,02.016.440/0001-62,True,BRAESLACNPR3
35393,AFLT,AFLUENTE TRANSMISSAO ENERGIA ELETRICA SA,AFLUENTET0NP,10.338.320/0001-00,True,BRAFLTACNOR1
35394,AFLU,AFLUENTE GERACAO ENERGIA ELETRICA SA,AFLUENTE0NQ,07.620.094/0001-40,True,BRAFLUACNOR9
35394,AFLU,AFLUENTE GERACAO ENERGIA ELETRICA SA,AFLUENTE0NQ,07.620.094/0001-40,True,BRAFLUACNPA2
35502,AGEI,AGRE EMPREENDIMENTOS IMOBILIARIOS SA,AGREEMPIM0QQ,11.040.082/0001-14,True,BRAGEIACNOR7
35540,AGIN,AGRA EMPREENDIMENTOS IMOBILIARIOS SA,AGRAINCOR0RS,07.698.047/0001-10,True,BRAGINACNOR8
35625,AGRA,AGRALE SA,AGRALE0U5,88.610.324/0001-92,True,BRAGRAACNPR3
35635,AGRO,BRASILAGRO CIA BRAS PROPRIEDADES AGRICOLAS,BRASILAGR0UF,07.628.528/0001-59,True,BRAGROACNOR7
99939,AGXY,AGROGALAXY PARTICIPACOES S A,AGROGALXY,21.240.146/0001-84,True,BRAGXYACNOR4
35700,AHEB,SAO PAULO TURISMO SA,SPTURIS0W8,62.002.886/0001-60,True,BRAHEBACNOR0
35700,AHEB,SAO PAULO TURISMO SA,SPTURIS0W8,62.002.886/0001-60,True,BRAHEBACNPA3
35700,AHEB,SAO PAULO TURISMO SA,SPTURIS0W8,62.002.886/0001-60,True,BRAHEBACNPB1
35813,ALBA,DANA ALBARUS SA IND COM,ALBARUS0ZD,92.758.085/0001-90,True,BRALBAACNOR0
35951,ALLD,ALLIED TECNOLOGIA SA,ALLIEDTEC137,20.247.322/0001-47,True,BRALLDACNOR3
35955,ALLL,RUMO SA,ALLAMERLA13B,02.387.241/0001-60,False,BRALLLACNOR6
35955,ALLL,RUMO SA,ALLAMERLA13B,02.387.241/0001-60,False,BRALLLACNPR3
64117,ALOS,ALLOS S A,ALLOS SA,05.878.397/0001-32,True,BRALOSACNOR5
36019,ALPA,ALPARGATAS SA,ALPARGATA153,61.079.117/0001-05,True,BRALPAACNOR0
36019,ALPA,ALPARGATAS SA,ALPARGATA153,61.079.117/0001-05,True,BRALPAACNPR7
36024,ALPK,ALLPARK EMPREENDIMENTOS PARTICIPACOES SERVICOS SA,ALLPARKEM158,60.537.263/0001-66,True,BRALPKACNOR9
36046,ALSC,ALIANSCE SHOPPING CENTERS SA,ALIANSCE15U,06.082.980/0001-03,True,BRALSCACNOR0
64117,ALOS,ALLOS S A,ALLOS SA,05.878.397/0001-32,True,BRALSOACNOR5
36073,ALUP,ALUPAR INVESTIMENTO S A,ALUPAR16L,08.364.948/0001-38,True,BRALUPACNOR8
36073,ALUP,ALUPAR INVESTIMENTO S A,ALUPAR16L,08.364.948/0001-38,True,BRALUPACNPR5
36105,AMAR,MARISA LOJAS SA,MARISALOJ17H,61.189.288/0001-89,True,BRAMARACNOR4
81882,AMBP,AMBIPAR PARTICIPACOES E EMPREENDIMENTOS S A,AMBIPARPART,12.648.266/0001-24,True,BRAMBPACNOR6
36126,AMBV,CIA BEBIDAS AMERICAS AMBEV,AMBEV182,02.808.708/0001-07,True,BRAMBVACNOR4
36126,AMBV,CIA BEBIDAS AMERICAS AMBEV,AMBEV182,02.808.708/0001-07,True,BRAMBVACNPR1
36133,AMCE,AMERICEL SA,AMERICEL189,01.685.903/0001-16,True,BRAMCEACNOR8
40197,AMER,AMERICANAS S A,AMERICANAS,00.776.574/0001-56,True,BRAMERACNOR6
36176,AMIL,AMIL PARTICIPACOES SA,AMILPARTI19G,36.461.242/0001-20,True,BRAMILACNOR0
36186,AMLC,AMELCO SA IND ELETRONICA,AMELCO19Q,57.009.078/0001-94,True,BRAMLCACNPR0
146170,AMOB,AUTOMOB PARTICIPACOES S A,AUTOMOB,35.654.688/0001-08,True,BRAMOBACNOR9
36206,AMPI,AMPLA INVESTS SERVICOS SA,AMPLAINVE1AA,07.809.905/0001-56,True,BRAMPIACNOR1
36224,AMRI,GEODEX COMMUNICATIONS BRASIL SA EX CONVEXX COMMUNICATIONS BRASIL SA,GEODEX1AS,02.808.710/0001-78,True,BRAMRIACNPD4
36314,ANDG,ANDRADE GUTIERREZ CONCESSOES SA,AGCONCESS1DA,03.601.314/0001-38,True,BRANDGACNOR9
36314,ANDG,ANDRADE GUTIERREZ CONCESSOES SA,AGCONCESS1DA,03.601.314/0001-38,True,BRANDGACNPR6
36353,ANIM,ANIMA HOLDING SA,ANIMA1ED,09.288.252/0001-32,True,BRANIMACNOR6
39752,APER,ALPER CONSULTORIA E CORRETORA DE SEGUROS S A,ALPERSEGUROS,11.721.921/0001-60,True,BRAPERACNOR9
36586,APTI,SIDERURGICA J L ALIPERTI SA,ALIPERTI1KU,61.156.931/0001-78,True,BRAPTIACNPR3
36708,ARCE,ARCELOR BRASIL SA,ARCELORBR1O8,24.315.012/0001-73,True,BRARCEACNOR7
36720,ARCZ,ARACRUZ CELULOSE SA,ARACRUZ1OK,42.157.511/0001-61,True,BRARCZACNOR2
36720,ARCZ,ARACRUZ CELULOSE SA,ARACRUZ1OK,42.157.511/0001-61,True,BRARCZACNPA5
36720,ARCZ,ARACRUZ CELULOSE SA,ARACRUZ1OK,42.157.511/0001-61,True,BRARCZACNPB3
36815,ARLA,ARTHUR LANGE SA IND COM,ARTHURLAN1R7,92.189.356/0001-33,True,BRARLAACNOR6
36815,ARLA,ARTHUR LANGE SA IND COM,ARTHURLAN1R7,92.189.356/0001-33,True,BRARLAACNPR3
94963,ARML,ARMAC LOCACAO LOGISTICA E SERVICOS S A,ARMAC,00.242.184/0001-04,True,BRARMLACNOR1
36867,ARPS,DOUAT CIA TEXTIL,DOUATTEXT1SN,82.610.726/0001-00,True,BRARPSACNOR9
36916,KUAL,KUALA SA EX ARTEX SA,KUALA1U0,82.640.723/0001-10,True,BRARTEACNOR1
36916,KUAL,KUALA SA EX ARTEX SA,KUALA1U0,82.640.723/0001-10,True,BRARTEACNPR8
36923,ARTR,ARTERIS SA,ARTERIS1U7,02.919.555/0001-67,True,BRARTRACNOR3
36969,AZZA,AZZAS 2154 S A,AZZAS 2154,16.590.234/0001-76,True,BRARZZACNOR3
75941,ASAI,SENDAS DISTRIBUIDORA S A,SENDAS,06.057.223/0001-71,True,BRASAIACNOR0
37079,ASSM,CIA ELDORADO HOTEIS,ELDORADO1YJ,62.791.116/0001-43,True,BRASSMACNOR4
37079,ASSM,CIA ELDORADO HOTEIS,ELDORADO1YJ,62.791.116/0001-43,True,BRASSMACNPR1
37091,ASTA,SANTISTA TEXTIL SA EX ALPARGATAS SANTISTA TEXTIL SA,SANTISTEX1YV,15.082.688/0001-73,True,BRASTAACNPR4
145319,ATED,ATOM EDUCACAO E EDITORA S A,ATOMEDUC,23.994.857/0001-70,True,BRATEDACNOR1
37155,ATEL,AUTEL SA TELECOMUNICACOES,AUTEL20N,47.709.365/0001-53,True,BRATELACNPR1
53467,ATMP,ATMA PARTICIPACOES S A,ATMASA,04.032.433/0001-80,True,BRATMPACNOR8
37260,FICT,FICTOR ALIMENTOS S A,FICTORALIMEN,00.359.742/0001-08,True,BRATOMACNOR1
108558,AURE,AUREN ENERGIA S A,AUREN,28.594.234/0001-23,True,BRAUREACNOR9
37383,AUTM,AUTOMETAL SA,AUTOMETAL26Z,59.104.513/0001-95,True,BRAUTMACNOR8
37428,AVIL,ACOS VILLARES SA,ACOSVILL288,60.664.810/0001-74,False,BRAVILACNOR1
37428,AVIL,ACOS VILLARES SA,ACOSVILL288,60.664.810/0001-74,False,BRAVILACNPR8
59324,AVLL,ALPHAVILLE S A,ALPHAVILLE,16.811.931/0001-00,True,BRAVLLACNOR5
37546,AZEV,AZEVEDO TRAVASSOS SA,AZEVEDO2BI,61.351.532/0001-68,True,BRAZEVACNOR0
37546,AZEV,AZEVEDO TRAVASSOS SA,AZEVEDO2BI,61.351.532/0001-68,True,BRAZEVACNPR7
37595,AZUL,AZUL SA,AZULSA2CV,09.305.994/0001-29,True,BRAZULACNPR4
36969,AZZA,AZZAS 2154 S A,AZZAS 2154,16.590.234/0001-76,True,BRAZZAACNOR9
37610,B3SA,B3 SA BRASIL BOLSA BALCAO,B32DA,09.346.601/0001-25,True,BRB3SAACNOR6
37624,BAAM,BCO BEA SA EX BCO ESTADO AMAZONAS SA,BANCOBEA2DO,04.562.120/0001-33,True,BRBAAMACNOR8
37624,BAAM,BCO BEA SA EX BCO ESTADO AMAZONAS SA,BANCOBEA2DO,04.562.120/0001-33,True,BRBAAMACNPR5
37656,BIED,BAHEMA EDUCACAO S A,BIOMA EDUC,45.987.245/0001-92,True,BRBAHIACNOR1
37656,BIED,BAHEMA EDUCACAO S A,BIOMA EDUC,45.987.245/0001-92,True,BRBAHIACNPA4
37656,BIED,BAHEMA EDUCACAO S A,BIOMA EDUC,45.987.245/0001-92,True,BRBAHIACNPR8
37674,BALM,BAUMER SA,BAUMER2F2,61.374.161/0001-30,True,BRBALMACNOR5
37674,BALM,BAUMER SA,BAUMER2F2,61.374.161/0001-30,True,BRBALMACNPR2
37720,BARB,SAINT GOBAIN CANALIZACAO SA EX CIA METALURGICA BARBARA,SGOBAINCA2GC,28.672.087/0001-62,True,BRBARBACNOR5
37720,BARB,SAINT GOBAIN CANALIZACAO SA EX CIA METALURGICA BARBARA,SGOBAINCA2GC,28.672.087/0001-62,True,BRBARBACNPR2
37737,BASU,BANCO COMERCIAL INVESTIMENTO SUDAMERIS SA,AMERICASU2GT,61.230.165/0001-44,True,BRBASUACNOR3
37737,BASU,BANCO COMERCIAL INVESTIMENTO SUDAMERIS SA,AMERICASU2GT,61.230.165/0001-44,True,BRBASUACNPA6
37737,BASU,BANCO COMERCIAL INVESTIMENTO SUDAMERIS SA,AMERICASU2GT,61.230.165/0001-44,True,BRBASUACNPB4
37746,BAUH,EXCELSIOR ALIMENTOS SA,EXCELSIOR2H2,95.426.862/0001-97,True,BRBAUHACNPR3
37760,BAZA,BCO AMAZONIA SA,AMAZONIA2HG,04.902.979/0001-44,True,BRBAZAACNOR0
37806,BBAS,BCO BRASIL SA,BRASIL2IQ,00.000.000/0001-91,True,BRBBASACNOR3
37806,BBAS,BCO BRASIL SA,BRASIL2IQ,00.000.000/0001-91,True,BRBBASACNPR0
37840,BBCM,BCO BANDEIRANTES SA,BANDEIRAN2JO,61.071.387/0001-61,True,BRBBCMACNOR2
37840,BBCM,BCO BANDEIRANTES SA,BANDEIRAN2JO,61.071.387/0001-61,True,BRBBCMACNPR9
37851,BBDC,BCO BRADESCO SA,BRADESCO2JZ,60.746.948/0001-12,True,BRBBDCACNOR1
37851,BBDC,BCO BRADESCO SA,BRADESCO2JZ,60.746.948/0001-12,True,BRBBDCACNPR8
38018,NEXP,NEXPE PARTICIPACOES S A,NEXPE,08.613.550/0001-98,True,BRBBRKACNOR4
38031,BBSE,BB SEGURIDADE PARTICIPACOES SA,BBSEGURID2OZ,17.344.597/0001-94,True,BRBBSEACNOR5
38093,BCAL,PRO METALURGIA SA,BICCALOI2QP,56.994.924/0001-05,False,BRBCALACNPB7
38260,BDEP,BCO PERNAMBUCO SA BANDEPE,BANDEPE2VC,10.866.788/0001-77,True,BRBDEPACNOR7
38284,BDLL,BARDELLA SA INDS MECANICAS,BARDELLA2W0,60.851.615/0001-53,True,BRBDLLACNOR1
38284,BDLL,BARDELLA SA INDS MECANICAS,BARDELLA2W0,60.851.615/0001-53,True,BRBDLLACNPR8
38375,BEBA,BCO BANEB SA EX BCO ESTADO BAHIA SA,BANEB2YJ,15.142.490/0001-38,True,BRBEBAACNPA6
38375,BEBA,BCO BANEB SA EX BCO ESTADO BAHIA SA,BANEB2YJ,15.142.490/0001-38,True,BRBEBAACNPB4
38379,BECE,BCO BEC SA,BANCOBEC2YN,07.196.934/0001-90,True,BRBECEACNOR3
38379,BECE,BCO BEC SA,BANCOBEC2YN,07.196.934/0001-90,True,BRBECEACNPR0
38389,BEEF,MINERVA SA,MINERVA2YX,67.620.377/0001-14,True,BRBEEFACNOR6
38390,BEES,BANESTES SA BCO ESTADO ESPIRITO SANTO,BANESTES2YY,28.127.603/0001-78,True,BRBEESACNOR9
38390,BEES,BANESTES SA BCO ESTADO ESPIRITO SANTO,BANESTES2YY,28.127.603/0001-78,True,BRBEESACNPR6
38420,BEMA,BEMATECH SA,BEMATECH2ZS,82.373.077/0001-71,True,BRBEMAACNOR0
38435,BEPA,BCO BANESTADO SA EX BCO ESTADO PARANA SA,BANESTADO307,76.492.172/0001-91,True,BRBEPAACNOR3
38435,BEPA,BCO BANESTADO SA EX BCO ESTADO PARANA SA,BANESTADO307,76.492.172/0001-91,True,BRBEPAACNPR0
38470,BESP,BCO ESTADO SAO PAULO SA,BANESPA316,61.411.633/0001-87,True,BRBESPACNOR5
38470,BESP,BCO ESTADO SAO PAULO SA,BANESPA316,61.411.633/0001-87,True,BRBESPACNPR2
38482,BEXC,BCO ALVORADA SA,BILBAOVIZ31I,33.870.163/0001-84,True,BRBEXCACNPR0
38510,BFCV,SPSCS INDL SA EX BRASINCA INDL SA,SPSCSINDL32A,59.290.239/0001-96,True,BRBFCVACNPR1
38544,BFIT,BCO SUDAMERIS BRASIL SA,SUDAMERIS338,60.942.638/0001-73,True,BRBFITACNOR5
38544,BFIT,BCO SUDAMERIS BRASIL SA,SUDAMERIS338,60.942.638/0001-73,True,BRBFITACNPR2
38635,BGIP,BCO ESTADO SERGIPE SA BANESE,BANESE35R,13.009.717/0001-46,True,BRBGIPACNOR1
38635,BGIP,BCO ESTADO SERGIPE SA BANESE,BANESE35R,13.009.717/0001-46,True,BRBGIPACNPR8
38650,BGOS,BCO BEG SA EX BCO ESTADO GOIAS SA,BEG366,01.540.541/0001-75,True,BRBGOSACNOR3
38650,BGOS,BCO BEG SA EX BCO ESTADO GOIAS SA,BEG366,01.540.541/0001-75,True,BRBGOSACNPR0
38678,BHEQ,BAHEMA EQUIPAMENTOS SA,BAHEMAEQU36Y,96.832.365/0001-51,True,BRBHEQACNOR6
38678,BHEQ,BAHEMA EQUIPAMENTOS SA,BAHEMAEQU36Y,96.832.365/0001-51,True,BRBHEQACNPR3
38683,BHGR,BHG SA BRAZIL HOSPITALITY GROUP,BHG373,08.723.106/0001-25,True,BRBHGRACNOR9
68127,BHIA,GRUPO CASAS BAHIA S A,VIA,33.041.260/0652-90,True,BRBHIAACNOR1
38721,BICB,CHINA CONSTRUCTION BANK BRASIL BCO MULTIPLO SA,CHINA385,07.450.604/0001-89,True,BRBICBACNOR0
38721,BICB,CHINA CONSTRUCTION BANK BRASIL BCO MULTIPLO SA,CHINA385,07.450.604/0001-89,True,BRBICBACNPR7
38726,BIDI,BANCO INTER SA,BANCO INTER,00.416.968/0001-01,True,BRBIDIACNOR3
38726,BIDI,BANCO INTER SA,BANCO INTER,00.416.968/0001-01,True,BRBIDIACNPR0
37656,BIED,BAHEMA EDUCACAO S A,BIOMA EDUC,45.987.245/0001-92,True,BRBIEDACNOR2
38762,BIOB,BIOBRAS SA,BIOBRAS39A,16.921.603/0001-66,True,BRBIOBACNOR5
38762,BIOB,BIOBRAS SA,BIOBRAS39A,16.921.603/0001-66,True,BRBIOBACNPA8
38762,BIOB,BIOBRAS SA,BIOBRAS39A,16.921.603/0001-66,True,BRBIOBACNPB6
38762,BIOB,BIOBRAS SA,BIOBRAS39A,16.921.603/0001-66,True,BRBIOBACNPC4
38762,BIOB,BIOBRAS SA,BIOBRAS39A,16.921.603/0001-66,True,BRBIOBACNPR2
38765,BIOM,BIOMM SA,BIOMM39D,04.752.991/0001-10,True,BRBIOMACNOR2
38765,BIOM,BIOMM SA,BIOMM39D,04.752.991/0001-10,True,BRBIOMACNPR9
38783,BISA,ERBE INCORPORADORA S A,ERBEINCORP,07.700.557/0001-84,True,BRBISAACNOR8
38823,ZAMP,ZAMP S A,ZAMP SA,13.574.594/0001-96,True,BRBKBRACNOR4
38854,BLAU,BLAU FARMACEUTICA SA,BLAUFARMA3BU,58.430.828/0001-60,True,BRBLAUACNOR8
52054,BLUT,BLUE TECH SOLUTIONS E Q I S A,B TECH EQI,60.637.238/0001-54,True,BRBLUTACNOR8
52054,BLUT,BLUE TECH SOLUTIONS E Q I S A,B TECH EQI,60.637.238/0001-54,True,BRBLUTACNPR5
39069,BMCT,BCO MERCANTIL SAO PAULO SA EX BCO MERCANTIL FINASA SA SAO PAULO,MERCSPAUL3HT,61.065.421/0001-95,True,BRBMCTACNOR4
39069,BMCT,BCO MERCANTIL SAO PAULO SA EX BCO MERCANTIL FINASA SA SAO PAULO,MERCSPAUL3HT,61.065.421/0001-95,True,BRBMCTACNPR1
39078,BMEB,BCO MERCANTIL BRASIL SA,MERCANTIL,17.184.037/0001-10,True,BRBMEBACNOR8
39078,BMEB,BCO MERCANTIL BRASIL SA,MERCANTIL,17.184.037/0001-10,True,BRBMEBACNPR5
39080,BMEF,BOLSA MERCADORIAS FUTUROS BMF SA,BOLSAMERC3I4,54.641.030/0001-06,True,BRBMEFACNOR9
39089,BMGB,BCO BMG SA,BMG3ID,61.186.680/0001-74,True,BRBMGBACNPR0
39105,BMIN,BCO MERCANTIL INVESTS SA,MERCINVES3IT,34.169.557/0001-72,True,BRBMINACNOR4
39105,BMIN,BCO MERCANTIL INVESTS SA,MERCINVES3IT,34.169.557/0001-72,True,BRBMINACNPR1
39107,BMKS,BICICLETAS MONARK SA,BICMONARK3IV,56.992.423/0001-90,True,BRBMKSACNOR9
98728,BMOB,BEMOBI MOBILE TECH S A,BEMOBI TECH,09.042.817/0001-05,True,BRBMOBACNOR7
39145,BMTO,BRASMOTOR SA,BRASMOTOR3JX,61.084.984/0001-20,True,BRBMTOACNOR9
39145,BMTO,BRASMOTOR SA,BRASMOTOR3JX,61.084.984/0001-20,True,BRBMTOACNPR6
39175,BNBR,BCO NORDESTE BRASIL SA,NORDBRASI3KR,07.237.373/0001-20,True,BRBNBRACNOR8
39175,BNBR,BCO NORDESTE BRASIL SA,NORDBRASI3KR,07.237.373/0001-20,True,BRBNBRACNPR5
39179,BNCA,BCO NOSSA CAIXA SA,BCONOSSAC3KV,43.073.394/0001-10,False,BRBNCAACNOR2
40351,BOAS,BOA VISTA SERVICOS S A,BOAVISTAS4HF,11.725.176/0001-27,True,BRBOASACNOR6
39315,BOBR,BOMBRIL SA EX BOMBRIL CIRIO SA,BOMBRIL3ON,50.564.053/0001-03,True,BRBOBRACNOR6
39315,BOBR,BOMBRIL SA EX BOMBRIL CIRIO SA,BOMBRIL3ON,50.564.053/0001-03,True,BRBOBRACNPR3
39385,BOVH,BOLSA VALORES SAO PAULO SA BVSP,BOVESPAHL3QL,08.695.953/0001-23,False,BRBOVHACNOR5
39411,BPAC,BCO BTG PACTUAL SA,BTGPBANCO3RB,30.306.294/0001-45,True,BRBPACACNOR7
39411,BPAC,BCO BTG PACTUAL SA,BTGPBANCO3RB,30.306.294/0001-45,True,BRBPACACNPA0
39415,BPAN,BANCO PAN S A,BANCOPANS3RF,59.285.411/0001-13,True,BRBPANACNPR1
39416,BPAR,BCO ESTADO PARA SA,BANPARA3RG,04.913.711/0001-08,True,BRBPARACNOR5
39432,BPCO,BOMPRECO SA SUPERMERCADOS NORDESTE,BOMPRECO3RW,13.004.510/0001-89,True,BRBPCOACNPR5
39470,BPHA,BRASIL PHARMA SA,BRPHARMA3SY,11.395.624/0001-71,True,BRBPHAACNOR6
39474,BPIA,BCO ESTADO PIAUI SA,ESTPIAUI3T2,06.833.131/0001-36,False,BRBPIAACNOR4
39489,BPLA,BRASPEROLA IND COM SA,BRASPEROL3TH,11.703.519/0001-52,True,BRBPLAACNOR8
39489,BPLA,BRASPEROLA IND COM SA,BRASPEROL3TH,11.703.519/0001-52,True,BRBPLAACNPA1
39607,BRAP,BRADESPAR SA,BRADESPAR3WR,03.847.461/0001-92,True,BRBRAPACNOR5
39607,BRAP,BRADESPAR SA,BRADESPAR3WR,03.847.461/0001-92,True,BRBRAPACNPR2
95514,BRAV,3R PETROLEUM OLEO E GAS S A,BRAVA,12.091.809/0001-55,True,BRBRAVACNOR3
39677,VBBR,VIBRA ENERGIA SA,VIBRA,34.274.233/0001-02,True,BRBRDTACNOR1
39677,VBBR,VIBRA ENERGIA SA,VIBRA,34.274.233/0001-02,True,BRBRDTACNPR8
39715,BRFS,BRF SA,BRFSA3ZR,01.838.723/0001-27,True,BRBRFSACNOR8
39726,BRGE,CONSORCIO ALFA ADMINISTRACAO SA EX CONS REAL BRAS ADMINISTRACAO SA,ALFACONSO402,17.193.806/0001-46,True,BRBRGEACNOR6
39726,BRGE,CONSORCIO ALFA ADMINISTRACAO SA EX CONS REAL BRAS ADMINISTRACAO SA,ALFACONSO402,17.193.806/0001-46,True,BRBRGEACNPA9
39726,BRGE,CONSORCIO ALFA ADMINISTRACAO SA EX CONS REAL BRAS ADMINISTRACAO SA,ALFACONSO402,17.193.806/0001-46,True,BRBRGEACNPB7
39726,BRGE,CONSORCIO ALFA ADMINISTRACAO SA EX CONS REAL BRAS ADMINISTRACAO SA,ALFACONSO402,17.193.806/0001-46,True,BRBRGEACNPC5
39726,BRGE,CONSORCIO ALFA ADMINISTRACAO SA EX CONS REAL BRAS ADMINISTRACAO SA,ALFACONSO402,17.193.806/0001-46,True,BRBRGEACNPD3
39726,BRGE,CONSORCIO ALFA ADMINISTRACAO SA EX CONS REAL BRAS ADMINISTRACAO SA,ALFACONSO402,17.193.806/0001-46,True,BRBRGEACNPE1
39726,BRGE,CONSORCIO ALFA ADMINISTRACAO SA EX CONS REAL BRAS ADMINISTRACAO SA,ALFACONSO402,17.193.806/0001-46,True,BRBRGEACNPF8
39734,BRHA,CIA CERVEJARIA BRAHMA,BRAHMA40A,33.366.980/0001-08,True,BRBRHAACNOR2
39734,BRHA,CIA CERVEJARIA BRAHMA,BRAHMA40A,33.366.980/0001-08,True,BRBRHAACNPR9
39752,APER,ALPER CONSULTORIA E CORRETORA DE SEGUROS S A,ALPERSEGUROS,11.721.921/0001-60,True,BRBRINACNOR3
103919,BRIT,BRISANET PARTICIPACOES S A,BRISANET,19.796.586/0001-70,True,BRBRITACNOR0
39755,BRIV,BCO ALFA INVEST SA EX BCO REAL INVEST SA,ALFAINVES40V,60.770.336/0001-65,True,BRBRIVACNOR6
39755,BRIV,BCO ALFA INVEST SA EX BCO REAL INVEST SA,ALFAINVES40V,60.770.336/0001-65,True,BRBRIVACNPR3
39774,BRKM,BRASKEM SA,BRASKEM41E,42.150.391/0001-70,True,BRBRKMACNOR1
39774,BRKM,BRASKEM SA,BRASKEM41E,42.150.391/0001-70,True,BRBRKMACNPA4
39774,BRKM,BRASKEM SA,BRASKEM41E,42.150.391/0001-70,True,BRBRKMACNPB2
39807,BRML,BR MALLS PARTICIPACOES SA,BRMALLSPA42B,06.977.745/0001-91,True,BRBRMLACNOR9
39857,BRPR,BR PROPERTIES SA,BRPROPERT43P,06.977.751/0001-49,True,BRBRPRACNOR9
39891,BRSR,BCO ESTADO RIO GRANDE SUL SA,BANRISUL44N,92.702.067/0001-96,True,BRBRSRACNOR3
39891,BRSR,BCO ESTADO RIO GRANDE SUL SA,BANRISUL44N,92.702.067/0001-96,True,BRBRSRACNPA6
39891,BRSR,BCO ESTADO RIO GRANDE SUL SA,BANRISUL44N,92.702.067/0001-96,True,BRBRSRACNPB4
39891,BRSR,BCO ESTADO RIO GRANDE SUL SA,BANRISUL44N,92.702.067/0001-96,True,BRBRSRACNPR0
101349,BRST,BRISANET SERVICOS DE TELECOMUNICACOES S A,BRISANET2SER,04.601.397/0001-28,True,BRBRSTACNOR9
39908,BRTO,BRASIL TELECOM SA,BRASILTEL454,76.535.764/0001-43,False,BRBRTOACNOR8
39908,BRTO,BRASIL TELECOM SA,BRASILTEL454,76.535.764/0001-43,False,BRBRTOACNPR5
39909,BRTP,BRASIL TELECOM PARTICIPACOES SA,BRASILTPA455,02.570.688/0001-70,False,BRBRTPACNOR5
39909,BRTP,BRASIL TELECOM PARTICIPACOES SA,BRASILTPA455,02.570.688/0001-70,False,BRBRTPACNPR2
39996,BSCT,BCO ESTADO SANTA CATARINA SA,BESC47K,83.876.003/0001-10,False,BRBSCTACNOR1
39996,BSCT,BCO ESTADO SANTA CATARINA SA,BESC47K,83.876.003/0001-10,False,BRBSCTACNPA4
39996,BSCT,BCO ESTADO SANTA CATARINA SA,BESC47K,83.876.003/0001-10,False,BRBSCTACNPB2
40006,BSEG,HSBC SEGUROS BRASIL SA EX HSBC BAMERINDUS SEGUROS SA,HSBCBAMSE47U,76.538.446/0001-36,True,BRBSEGACNOR4
40006,BSEG,HSBC SEGUROS BRASIL SA EX HSBC BAMERINDUS SEGUROS SA,HSBCBAMSE47U,76.538.446/0001-36,True,BRBSEGACNPR1
40010,BSEV,BIOSEV SA,BIOSEV47Y,15.527.906/0001-36,True,BRBSEVACNOR3
40020,BSGR,AGF BRASIL SEGUROS SA,AGFBRASIL488,61.573.796/0001-66,True,BRBSGRACNOR6
40048,BSLI,BRB BCO BRASILIA SA,BRBBANCO490,00.000.208/0001-00,True,BRBSLIACNOR5
40048,BSLI,BRB BCO BRASILIA SA,BRBBANCO490,00.000.208/0001-00,True,BRBSLIACNPR2
40197,AMER,AMERICANAS S A,AMERICANAS,00.776.574/0001-56,True,BRBTOWACNOR8
40230,EPAR,EMBPAR PARTICIPACOES SA,EMBPAR  SA,42.331.462/0001-31,True,BRBTTLACNOR0
40230,EPAR,EMBPAR PARTICIPACOES SA,EMBPAR  SA,42.331.462/0001-31,True,BRBTTLACNPR7
40248,BUET,BUETTNER SA IND COM,BUETTNER4EK,82.981.812/0001-20,True,BRBUETACNOR3
40248,BUET,BUETTNER SA IND COM,BUETTNER4EK,82.981.812/0001-20,True,BRBUETACNPR0
40328,BVMF,B3 S A BRASIL BOLSA BALCAO,BMFBOVESP4GS,09.346.601/0001-25,False,BRBVMFACNOR3
40659,CQF3,CAFE SOLUVEL BRASILIA SA,CAFBRASIL4PZ,25.869.736/0001-21,True,BRCAFEACNOR2
40659,CQF3,CAFE SOLUVEL BRASILIA SA,CAFBRASIL4PZ,25.869.736/0001-21,True,BRCAFEACNPR9
40673,CAIA,CAIANDA PARTICIPACOES SA,CAIANDAPA4QD,04.038.763/0001-82,True,BRCAIAACNPR1
40700,CALI,CONSTRUTORA ADOLPHO LINDENBERG SA,CONSTALIN4R4,61.022.042/0001-18,True,BRCALIACNOR1
40700,CALI,CONSTRUTORA ADOLPHO LINDENBERG SA,CONSTALIN4R4,61.022.042/0001-18,True,BRCALIACNPR8
40714,CAMB,CAMBUCI SA,CAMBUCI4RI,61.088.894/0001-08,True,BRCAMBACNOR4
40714,CAMB,CAMBUCI SA,CAMBUCI4RI,61.088.894/0001-08,True,BRCAMBACNPR1
40717,CAML,CAMIL ALIMENTOS SA,CAMILALIM4RL,64.904.295/0001-03,True,BRCAMLACNOR3
40777,CARB,NITROCARBONO SA,NITROCARB4T9,13.558.218/0001-08,False,BRCARBACNPA6
40777,CARB,NITROCARBONO SA,NITROCARB4T9,13.558.218/0001-08,False,BRCARBACNPB4
40778,CSUD,CSU CARDSYSTEM SA,CSU DIGITAL,01.896.779/0001-38,True,BRCARDACNOR9
96022,CASH,MELIUZ S A,MELIUZ,14.110.585/0001-07,True,BRCASHACNOR8
40805,CASN,CIA CATARINENSE AGUAS SANEAMENTO CASAN,CASAN4U1,82.508.433/0001-17,True,BRCASNACNOR6
40805,CASN,CIA CATARINENSE AGUAS SANEAMENTO CASAN,CASAN4U1,82.508.433/0001-17,True,BRCASNACNPR3
40850,CBAG,CIA BANDEIRANTES ARMAZENS GERAIS,BANARMAZE4VA,58.128.174/0001-14,True,BRCBAGACNOR6
103717,CBAV,COMPANHIA BRASILEIRA DE ALUMINIO,CBA,61.409.892/0001-73,True,BRCBAVACNOR5
40865,CBEE,AMPLA ENERGIA SERVICOS SA,AMPLAENER4VP,33.050.071/0001-58,True,BRCBEEACNOR3
40887,CBMA,COBRASMA SA,COBRASMA4WB,61.080.313/0001-91,True,BRCBMAACNOR4
40887,CBMA,COBRASMA SA,COBRASMA4WB,61.080.313/0001-91,True,BRCBMAACNPR1
40987,CCHI,CERAMICA CHIARELLI SA,CHIARELLI4Z3,52.736.840/0001-10,True,BRCCHIACNOR5
40987,CCHI,CERAMICA CHIARELLI SA,CHIARELLI4Z3,52.736.840/0001-10,True,BRCCHIACNPR2
40994,CCIM,CAMARGO CORREA DESENVOLVIMENTO IMOBILIARIO SA,CCDESIMOB4ZA,67.203.208/0001-89,True,BRCCIMACNOR5
41026,SYNE,SYN PROP E TECH S A,SYN PROP TEC,08.801.621/0001-86,True,BRCCPRACNOR9
41034,CCRO,CCR SA,CCRSA50E,02.846.056/0001-97,True,BRCCROACNOR2
41045,CCTU,CIA BRASILEIRA CARTUCHOS,CBCCARTUC50P,57.494.031/0001-63,True,BRCCTUACNPR2
41051,CCXC,CCX CARVAO COLOMBIA SA,CCXCARVAO50V,07.950.674/0001-04,True,BRCCXCACNOR5
41107,CDOU,CENTRAIS ELETRICAS CAHOEIRA DOURADA SA,CACHDOURA52F,01.672.223/0001-68,True,BRCDOUACNOR4
41107,CDOU,CENTRAIS ELETRICAS CAHOEIRA DOURADA SA,CACHDOURA52F,01.672.223/0001-68,True,BRCDOUACNPR1
80566,CEAB,C A MODAS S A,CEA,45.242.914/0001-05,True,BRCEABACNOR1
41147,CEBR,CIA ENERGETICA BRASILIA,CEB53J,00.070.698/0001-11,True,BRCEBRACNOR5
41147,CEBR,CIA ENERGETICA BRASILIA,CEB53J,00.070.698/0001-11,True,BRCEBRACNPA8
41147,CEBR,CIA ENERGETICA BRASILIA,CEB53J,00.070.698/0001-11,True,BRCEBRACNPB6
41152,CECI,CIA INDL AGRICOLA SANTA CECILIA,STACECILI53O,33.433.822/0001-15,True,BRCECIACNOR2
41155,CEDO,CIA FIACAO TECIDOS CEDRO CACHOEIRA,CEDRO53R,17.245.234/0001-00,True,BRCEDOACNOR8
41155,CEDO,CIA FIACAO TECIDOS CEDRO CACHOEIRA,CEDRO53R,17.245.234/0001-00,True,BRCEDOACNPA1
41155,CEDO,CIA FIACAO TECIDOS CEDRO CACHOEIRA,CEDRO53R,17.245.234/0001-00,True,BRCEDOACNPB9
41155,CEDO,CIA FIACAO TECIDOS CEDRO CACHOEIRA,CEDRO53R,17.245.234/0001-00,True,BRCEDOACNPR5
41159,CEEB,CIA ELETRICIDADE ESTADO BAHIA COELBA,COELBA53V,15.139.629/0001-94,True,BRCEEBACNOR3
41159,CEEB,CIA ELETRICIDADE ESTADO BAHIA COELBA,COELBA53V,15.139.629/0001-94,True,BRCEEBACNPA6
41160,CEED,CIA ESTADUAL DISTRIBUICAO ENERGIA ELETRICA CEEE D,CEEED53W,08.467.115/0001-00,True,BRCEEDACNOR9
41160,CEED,CIA ESTADUAL DISTRIBUICAO ENERGIA ELETRICA CEEE D,CEEED53W,08.467.115/0001-00,True,BRCEEDACNPR6
41166,CEGR,CIA DISTRIBUIDORA GAS RIO JANEIRO CEG,CEG542,33.938.119/0001-69,True,BRCEGRACNOR4
41183,CELM,CELM CIA EQUIPADORA LABORATORIOS MODERNOS,CELM54J,61.086.823/0001-76,True,BRCELMACNOR5
41185,EQPA,EQUATORIAL PARA DISTRIBUIDORA DE ENERGIA S A,EQTL PARA,04.895.728/0001-80,True,BRCELPACNOR8
41185,EQPA,EQUATORIAL PARA DISTRIBUIDORA DE ENERGIA S A,EQTL PARA,04.895.728/0001-80,True,BRCELPACNPA1
41185,EQPA,EQUATORIAL PARA DISTRIBUIDORA DE ENERGIA S A,EQTL PARA,04.895.728/0001-80,True,BRCELPACNPB9
41185,EQPA,EQUATORIAL PARA DISTRIBUIDORA DE ENERGIA S A,EQTL PARA,04.895.728/0001-80,True,BRCELPACNPC7
41198,CEPE,CIA ENERGETICA PERNAMBUCO CELPE,CELPE54Y,10.835.932/0001-08,True,BRCEPEACNOR3
41198,CEPE,CIA ENERGETICA PERNAMBUCO CELPE,CELPE54Y,10.835.932/0001-08,True,BRCEPEACNPA6
41198,CEPE,CIA ENERGETICA PERNAMBUCO CELPE,CELPE54Y,10.835.932/0001-08,True,BRCEPEACNPB4
41219,CESP,CESP CIA ENERGETICA SAO PAULO,CESP55J,60.933.603/0001-78,True,BRCESPACNOR3
41219,CESP,CESP CIA ENERGETICA SAO PAULO,CESP55J,60.933.603/0001-78,True,BRCESPACNPA6
41219,CESP,CESP CIA ENERGETICA SAO PAULO,CESP55J,60.933.603/0001-78,True,BRCESPACNPB4
41219,CESP,CESP CIA ENERGETICA SAO PAULO,CESP55J,60.933.603/0001-78,True,BRCESPACNPR0
41221,CETE,CETERP CENTRAIS TELEFONICAS RIBEIRAO PRETO SA,CETERP55L,00.956.274/0001-59,True,BRCETEACNOR5
41221,CETE,CETERP CENTRAIS TELEFONICAS RIBEIRAO PRETO SA,CETERP55L,00.956.274/0001-59,True,BRCETEACNPR2
41231,CEVA,BUNGE ALIMENTOS SA EX CEVAL ALIMENTOS SA,BUNGEALIM55V,84.046.101/0001-93,True,BRCEVAACNOR9
41231,CEVA,BUNGE ALIMENTOS SA EX CEVAL ALIMENTOS SA,BUNGEALIM55V,84.046.101/0001-93,True,BRCEVAACNPR6
41281,CFLU,CIA FLUMINENSE REFRIGERANTES,FLUMREGRI579,31.456.338/0001-86,True,BRCFLUACNOR5
41281,CFLU,CIA FLUMINENSE REFRIGERANTES,FLUMREGRI579,31.456.338/0001-86,True,BRCFLUACNPR2
41332,CGAS,CIA GAS SAO PAULO COMGAS,COMGAS58O,61.856.571/0001-17,True,BRCGASACNOR0
41332,CGAS,CIA GAS SAO PAULO COMGAS,COMGAS58O,61.856.571/0001-17,True,BRCGASACNPA3
41332,CGAS,CIA GAS SAO PAULO COMGAS,COMGAS58O,61.856.571/0001-17,True,BRCGASACNPR7
41370,CGOS,EQUATORIAL GOIAS DISTRIBUIDORA DE ENERGIA S A,EQUATGOIAS,01.543.032/0001-04,True,BRCGOSACNOR1
41370,CGOS,EQUATORIAL GOIAS DISTRIBUIDORA DE ENERGIA S A,EQUATGOIAS,01.543.032/0001-04,True,BRCGOSACNPB2
41370,CGOS,EQUATORIAL GOIAS DISTRIBUIDORA DE ENERGIA S A,EQUATGOIAS,01.543.032/0001-04,True,BRCGOSACNPR8
41375,CGRA,GRAZZIOTIN SA,GRAZZIOTI59V,92.012.467/0001-70,True,BRCGRAACNOR2
41375,CGRA,GRAZZIOTIN SA,GRAZZIOTI59V,92.012.467/0001-70,True,BRCGRAACNPR9
41405,CHAP,SA IND COM CHAPECO,CHAPECO5AP,83.296.889/0001-23,True,BRCHAPACNOR4
41405,CHAP,SA IND COM CHAPECO,CHAPECO5AP,83.296.889/0001-23,True,BRCHAPACNPR1
41545,CIEL,CIELO SA,CIELO5EL,01.027.058/0001-91,True,BRCIELACNOR3
41553,CIIT,CIA INDL ITAUNENSE,ITAUNENSE5ET,21.254.073/0001-80,True,BRCIITACNPR4
41580,CIQU,CIA CACIQUE CAFE SOLUVEL,CACIQUE5FK,78.588.415/0001-15,True,BRCIQUACNOR8
